{
  "$schema": "https://json-schema.org/draft/2020-12/schema",
  "$id": "v1/annotation.json",
  "title": "Annotation",
  "type": "object",
  "properties": {
    "object_type": {
      "const": "annotation"
    },
    "media_id": {
      "type": "string",
      "pattern": "^[a-zA-Z0-9]+:.*$"
    },
    "bopp_version": {
      "type": "string",
      "pattern": "^1\\.\\d+\\.\\d+$",
      "description": "The Semantic Version of the BOPP schema (e.g., 1.0.0)"
    },
    "metadata": {
      "description": "The metadata describing the annotation",
      "$ref": "metadata.json"
    },
    "extent": {
      "description": "The parallel array of time/space boundaries (e.g., time_interval, point)",
      "$ref": "extents.json"
    },
    "payload": {
      "description": "The parallel array of values (e.g., beat, chord)",
      "$ref": "payloads.json"
    },
    "confidence": {
      "description": "Optional parallel array of likelihoods or votes",
      "$ref": "confidences.json"
    }
  },
  "required": [
    "media_id",
    "payload"
  ],
  "description": "A single timeline of observations: one extent + one payload (+ optional confidence) as parallel columnar arrays."
}
